{"annotation_warnings":[],"annotations_dropped":0,"counts_by_kind":{"annotation":1,"model_completed":2,"model_delta":2,"model_retry":1,"policy_checked":1,"policy_denied":1,"run_completed":1,"run_started":1,"stage_completed":3,"stage_started":3,"tool_call_completed":7,"tool_call_failed":1,"tool_call_started":8,"transition_selected":2},"duration_ms":0,"event_count":34,"events_sha256":"sha256:173649922f9c0d23a7000e7b13ea66e9b9f8f3b603e6041a32a16cd4552f6a4a","format":"nemoir.trace.summary/0.1","stage_visit_count":3}